25;La station spatiale internationale a abandonné Windows au profit de quelle distribution Linux ?;Debian;SUSE;Red Hat;Ubuntu;Expert;Debian est utilisée comme base de nombreuses autres distributions telles que Knoppix et Ubuntu qui rencontrent un grand succès.;http://fr.wikipedia.org/wiki/Debian
26;Quel pays utilise à ce jour le plus Linux comme système d'exploitation de bureau ?;Cuba;Le Venezuela;Le Kenya;La Finlande;Expert;Les deux environnements GNOME et KDE, qui reposent sur des technologies communes, ont atteint une maturité certaine.;http://fr.wikipedia.org/wiki/Linux
27;Quel graphiste a dessiné en 1996 le manchot Tux initial, mascotte du projet Linux ?;Larry Ewing;Jeffrey Lynch;Rob Janoff;Wes Wilson;Expert;Ce programmeur américain a réalisé la mascotte Tux avec l'aide du logiciel libre The GIMP.;http://fr.wikipedia.org/wiki/Larry_Ewing
28;Lequel de ces jeux tourne nativement sous GNU/Linux ?;Quake III Arena;Super Mario Kart;Zelda;Splinter Cell;Expert;Le jeu développé par id Software a également été publié sur Macintosh, sur Dreamcast, sur PlayStation 2 et sur Xbox Live Arcade.;http://fr.wikipedia.org/wiki/Quake_III_Arena
29;Quelle console de jeu open source possède un système d'exploitation Linux compilé ?;Pandora;Game Gear;N-Gage;GP32;Expert;La Pandora est capable à ce jour de lancer Quake, Quake II et Quake III Arena sans ralentissement.;http://fr.wikipedia.org/wiki/Pandora_(console_portable)
30;Comment fut initialement appelé le projet Linux, qui deviendra par la suite une marque déposée ?;Freax;Serval;Panther;Longhorn;Expert;Le projet trouve son nom définitif grâce à Ari Lemmke qui héberge le travail de Linus Torvalds dans un répertoire nommé Linux.;http://fr.wikipedia.org/wiki/Linux1;De quel instrument de musique joue Lisa Simpson, créée par le dessinateur Matt Groening ?;Du saxophone;De la trompette;Du piano;De la flûte;Débutant;Les Simpson forment une famille américaine typique de classe moyenne qui vit dans la ville de Springfield.;http://fr.wikipedia.org/wiki/Lisa_Simpson
2;Quel instrument de musique à cordes pincées, voisin de la guitare, est utilisé en Inde ?;Le sitar;La cithare;Le théorbe;Le glingi;Débutant;On en joue assis en tailleur par terre : l'instrument, calé sous le coude droit, repose par terre (parfois sur le pied).;http://fr.wikipedia.org/wiki/Sitar
3;Pour quel instrument Mozart a-t-il composé le plus grand nombre de concerto ?;Le piano;La clarinette;Le violon;Le violoncelle;Débutant;Mort à trente-cinq ans, Mozart laissa une œuvre importante qui embrasse tous les genres musicaux de son époque.;http://fr.wikipedia.org/wiki/Wolfgang_Amadeus_Mozart
4;Combien de cordes possède un violon, occupant une place importante en musique classique ?;4 cordes;3 cordes;5 cordes;6 cordes;Débutant;Les luthiers comme Antonio Stradivari sont les artisans qui créent et entretiennent les instruments à cordes.;http://fr.wikipedia.org/wiki/Violon
5;Quel instrument de musique à cordes pincées est souvent utilisé dans la musique country ?;Le banjo;Le danjo;Le ranjo;Le panjo;Débutant;Accompagnateur dans le style « New Orleans », le banjo est également utilisé comme soliste dans la musique irlandaise.;http://fr.wikipedia.org/wiki/Banjo
6;En quelle matière est faite la mèche présente sur un archet de violon ?;En crin;En coton;En mohair;En angora;Débutant;La mèche est constituée de crins de cheval prélevés sur la queue de l'étalon car ceux de jument sont abîmés par l'urine.;http://fr.wikipedia.org/wiki/Archet_(musique)
7;De quel instrument de musique à vent et à anche libre joue un harmoniciste ?;Harmonica;Harmonium;Accordéon;Xylophone;Débutant;Malgré la connaissance réduite du public, il semblerait que l'harmonica soit en quantité l'instrument le plus vendu au monde.;http://fr.wikipedia.org/wiki/Harmonica
8;Combien de cordes au minimum compte-t-on sur une guitare basse, avec un diapason de 34 pouces ?;Quatre;Trois;Cinq;Six;Débutant;Depuis les années 1950, la guitare basse a remplacé la contrebasse dans la musique rock.;http://fr.wikipedia.org/wiki/Guitare_basse
9;De quel instrument John Lennon jouait-il au sein des Beatles avec plus de 200 chansons ?;De la guitare;Du clavier;De la batterie;Du saxophone;Débutant;Lennon forme avec McCartney l'un des tandems d'auteurs-compositeurs les plus influents et prolifiques de l'histoire du rock.;http://fr.wikipedia.org/wiki/John_Lennon
10;Instrument de la famille des violons, dans quelle position joue-t-on du violoncelle ?;Assise;Debout;Couchée;À genoux;Débutant;Le violoncelle se joue assis, tenu entre les jambes et repose désormais sur une pique escamotable.;http://fr.wikipedia.org/wiki/Violoncelle
11;Quelle clef, proche du la du diapason, est utilisée par le violoniste ?;La clef de sol;La clef de fa;La clef de do;La clef de ré;Confirmé;En solfège, une clé est un signe graphique placé au début de la portée qui indique la hauteur des notes associées à chaque ligne.;http://fr.wikipedia.org/wiki/Clef_(musique)
12;Quel instrument fut popularisé par Lionel Hampton à la fin des années 1930 ?;Le vibraphone;Le xylophone;Le saxophone;Le métallophone;Confirmé;Surnommé « Le lion », Lionel Hampton a été le premier géant du jazz à donner ses lettres de noblesse au vibraphone.;http://fr.wikipedia.org/wiki/Lionel_Hampton
13;Sur quel instrument à percussion frappe-t-on avec une baguette à tampon ?;Un gong;Un bong;Un bang;Un gang;Confirmé;L'instrument en lui-même provient vraisemblablement des percussions en bronze de Chine.;http://fr.wikipedia.org/wiki/Gong_(instrument)
14;De quel instrument Ginger Baker était-il tenu pour un virtuose ?;La batterie;La trompette;Le violon;La guitare;Confirmé;Depuis 1986, Ginger Baker a sorti plusieurs albums de jazz fusion et a tourné avec des groupes de styles variés.;http://fr.wikipedia.org/wiki/Ginger_Baker
15;Quel instrument de musique assez répandu en Grèce est joué avec un plectre ?;Le bouzouki;Le rebetiko;Le baglama;Le trypes;Confirmé;Le bouzouki est souvent considéré comme l'instrument « national » de la Grèce depuis le milieu du XXe siècle.;http://fr.wikipedia.org/wiki/Bouzouki
16;La balalaïka est un instrument de musique à cordes pincées russe, mais de quelle forme ?;Triangulaire;Ronde;Carrée;Rectangulaire;Confirmé;La balalaïka se joue le plus souvent au doigt et parfois avec un plectre et se décline en plusieurs tailles.;http://fr.wikipedia.org/wiki/Balalaïka
17;Quel instrument de musique est le plus aigu dans un orchestre symphonique ?;Le piccolo;Le tuba;Le trombone;Le hautbois;Confirmé;Le piccolo était surtout utilisé pour doubler la grande flûte à l'octave supérieure, pour augmenter l'éclat orchestral.;http://fr.wikipedia.org/wiki/Piccolo_(musique)
18;Dans quel pays joue-t-on du sitar et du vînâ, sorte de cithare sur bâton avec deux résonateurs ?;En Inde;Au Maroc;En Espagne;Au Brésil;Confirmé;La rudra vinâ est le plus ancien des instruments à cordes frettées indiens : on la nomme aussi bîn.;http://fr.wikipedia.org/wiki/Vînâ
19;Quel instrument de musique figure sur les étiquettes de la brasserie irlandaise Guinness ?;Une harpe;Un violon;Un saxophone;Une flûte;Confirmé;La Guinness est un stout, une bière noire coiffée d'une mousse blanche, connue mondialement pour sa saveur et son aspect.;http://fr.wikipedia.org/wiki/Guinness
20;Combien de pistons une trompette compte-t-elle, en réponse au vœu de rendre chromatique ?;Trois;Deux;Quatre;Cinq;Confirmé;La trompette à pistons est celle qui est la plus utilisée aujourd'hui dans la plupart des pays.;http://fr.wikipedia.org/wiki/Trompette
21;Combien y a-t-il de cordes sur une harpe de concert, obtenant ainsi une tessiture de 6 octaves ?;47;37;57;67;Expert;La harpe de concert a la particularité d'avoir des cordes perpendiculaires à la caisse de résonance.;http://fr.wikipedia.org/wiki/Harpe
22;Quelle est la fréquence du diapason, constitué de deux lames parallèles soudées en forme de U ?;440 hertz;450 hertz;460 hertz;430 hertz;Expert;En musique, le diapason est un outil de musicien donnant la hauteur d'une note-repère conventionnelle.;http://fr.wikipedia.org/wiki/Diapason
23;Quelle partie du violon le violoniste bloque-t-il entre son cou et son épaule ?;La mentonnière;Le reposoir;La mâchoire;Le dépauloire;Expert;Un violon se compose de trois parties distinctes : la caisse de résonance, le manche et les cordes.;http://fr.wikipedia.org/wiki/Violon
24;De quel mollusque peut-on utiliser le coquillage comme instrument de musique à vent ?;La conque;Le sifflet;Le dizi;Le piri;Expert;Prenant la conque en main, l'instrumentiste en produit le son selon le même principe que la trompe ou la corne.;http://fr.wikipedia.org/wiki/Conque
25;Quelle est la tonalité la plus fréquente des bourdons de la cornemuse écossaise ?;Le si bémol;Le sol;Le mi bémol;Le do;Expert;Les anches doubles sont aussi utilisées par le basson, la chalémie, le hautbois, la bombarde, ou encore le cor anglais.;http://fr.wikipedia.org/wiki/Cornemuse
26;De combien de pièces de bois, collées ou assemblées, un violon est-il composé ?;71 pièces;91 pièces;51 pièces;31 pièces;Expert;Dans les formations de musique classique, le violon est l'instrument le plus petit et de tessiture la plus aiguë parmi sa famille.;http://fr.wikipedia.org/wiki/Violon
27;Quel instrument de musique est aussi connu sous le nom de « trompette tsigane » ?;La guimbarde;La crécelle;La harpe;La bandurria;Expert;Composée de deux éléments, la guimbarde est l'un des instruments de musique les plus anciens du monde.;http://fr.wikipedia.org/wiki/Guimbarde_(instrument)
28;Quelle petite flûte traversière était autrefois utilisée dans les fanfares militaires ?;Le fifre;Le kaval;Le sodina;La gasba;Expert;Le fifre, de petite longueur et fabriqué en bois, comporte six ou sept trous de jeu et parfois une clé.;http://fr.wikipedia.org/wiki/Fifre_(musique)
29;Quel marteau léger est utilisé pour frapper différents instruments à percussion ?;La mailloche;Le dérivoir;Le brochoir;La tricoise;Expert;Différentes variétés de mailloches (aussi parfois appelées « cigognes ») permettent d'obtenir des sons différents.;http://fr.wikipedia.org/wiki/Mailloche
30;Quel instrument de musique traditionnel à cordes est devenu celui des geisha ?;Le shamisen;Le koto;Le shakuhachi;Le taiko;Expert;Le shamisen se joue agenouillé sur un zabuton en pinçant les cordes à l'aide d'un large plectre en ivoire.;http://fr.wikipedia.org/wiki/Shamisen1;À quelle classe d'animaux vertébrés regroupant près de 5 400 espèces appartient le chat ?;Aux mammifères;Aux reptiles;Aux oiseaux;Aux poissons;Débutant;De nombreux mammifères élevés par l'homme jusqu'au XIXème siècle ont disparu ou ont fortement régressé.;http://fr.wikipedia.org/wiki/Mammifère
2;Lorsque vous apercevez votre chat faire le gros dos, il est probablement...;Effrayé;Content;Malade;En chasse;Débutant;Si un chat fait une chute de deux mètres et plus alors qu'il est sur le dos, il peut se retourner afin d'amortir cette chute.;http://fr.wikipedia.org/wiki/Chat
3;Que fait principalement le chat de ses journées, selon de nombreux proverbes et idiotismes ?;Il dort;Il mange;Il boit;Il court;Débutant;La plupart de ces dictons datent de plusieurs siècles, certains remontent même au Moyen Âge.;http://fr.wikipedia.org/wiki/Chat
4;Dans quel endroit du globe le chat reste-t-il synonyme de chance, de richesse ou de longévité ?;En Asie;En Europe;En Australie;En Afrique;Débutant;Ce félin a laissé son empreinte dans la culture populaire au travers d'expressions populaires et de représentations diverses.;http://fr.wikipedia.org/wiki/Chat
5;Combien le chat possède-t-il de doigts aux pattes antérieures ?;Cinq;Quatre;Trois;Six;Débutant;Le chat possède cinq doigts aux pattes antérieures, dont seulement quatre touchent le sol, le pouce restant à l'écart.;http://fr.wikipedia.org/wiki/Chat
6;Quel est le cri du chat, pourtant très peu utilisé lorsque des chats communiquent entre eux ?;Le miaulement;Le jappement;Le bêlement;Le beuglement;Débutant;Par contre, au contact de l'humain, le chat continue souvent à utiliser différentes vocalises pour communiquer.;http://fr.wikipedia.org/wiki/Chat
7;Lequel de ces chats est le seul à avoir des poils longs ?;Angora;Abyssin;Siamois;Chartreux;Débutant;L'angora turc est caractérisé par sa robe à poils mi-longs très soyeuse et sans sous-poils.;http://fr.wikipedia.org/wiki/Angora_turc
8;De quelle famille de carnivores féliformes le chat fait-il partie ?;Les félidés;Les canidés;Les mustélidés;Les hominidés;Débutant;Parmi leurs traits caractéristiques figurent leur tête ronde au crâne raccourci, leur mâchoire à trente dents et leurs griffes rétractiles.;http://fr.wikipedia.org/wiki/Felidae
9;Quelle manifestation sonore du chat aurait selon certains spécialistes un effet relaxant sur l'homme ?;Le ronronnement;Le bourdonnement;Le meuglement;Le roucoulement;Débutant;Produit à l'expiration comme à l'inspiration, ce son de basse fréquence apparaît dès l'âge de deux jours.;http://fr.wikipedia.org/wiki/Ronronnement
10;Le chat, qui possède une mâchoire et une denture lui permettant de chasser, est un mammifère...;Carnivore;Omnivore;Frugivore;Insectivore;Débutant;Tous les mammifères carnassiers ne sont pas forcément membres de l'ordre des carnivores.;http://fr.wikipedia.org/wiki/Chat
11;Comment appelle-ton les longs poils présents sur les moustaches du chat ?;Les vibrisses;Les bréchets;Les barbules;Les tectrices;Confirmé;Chez l'Homme, les vibrisses désignent les poils à l'intérieur des narines et sous les bras.;http://fr.wikipedia.org/wiki/Vibrisse
12;Combien pèse environ un chaton à la naissance, directement soumis à un élevage communautaire ?;100 g;300 g;500 g;700 g;Confirmé;En cas de disparition d'une des mères, les chatons orphelins sont ainsi élevés par les autres femelles.;http://fr.wikipedia.org/wiki/Chaton
13;Bien que n'étant pas un coureur de fond, quelle vitesse maximale peut atteindre un chat ?;50 Km/h;70 Km/h;90 Km/h;110 Km/h;Confirmé;À la course, la vitesse moyenne du chat est de 40 km/h et il met environ neuf secondes pour parcourir 100 mètres.;http://fr.wikipedia.org/wiki/Chat
14;Combien de temps une chatte garde-t-elle environ les petits dans son ventre ?;Neuf semaines;Neuf minutes;Neuf mois;Neuf jours;Confirmé;Le ventre de la chatte commence à gonfler vers 4 semaines et à environ 35 jours, les mamelles grossissent et rosissent.;http://fr.wikipedia.org/wiki/Chat
15;Combien de races différentes de chats sont reconnues par les instances de certification ?;50;80;110;140;Confirmé;Dans de nombreux pays, le chat entre dans le cadre de la législation sur les carnivores domestiques à l’instar du chien et du furet.;http://fr.wikipedia.org/wiki/Chat
16;De combien d'os est composé le squelette du chat, comprenant une partie axiale et appendiculaire ?;250;220;190;160;Confirmé;Les vertèbres du cou du chat sont courtes et sa colonne vertébrale est quant à elle très souple.;http://fr.wikipedia.org/wiki/Anatomie_du_chat
17;Combien de temps un chat mettra-t-il pour parcourir 100m le plus rapidement possible ?;9 secondes;12 secondes;15 secondes;18 secondes;Confirmé;Les spécificités de l'anatomie du chat confèrent à cet animal une grande souplesse et une détente ample lors des sauts.;http://fr.wikipedia.org/wiki/Chat
18;Quel est en moyenne le nombre de lapées par seconde pour le chat ?;Quatre;Trois;Deux;Cinq;Confirmé;Une hypothèse expliquant ce lapement met en cause la région extrêmement sensible du nez et des moustaches du chat.;http://fr.wikipedia.org/wiki/Chat
19;Quel chat est le seul à être caractérisé par la quasi-absence de sa fourrure.;Le sphynx;Le siamois;Le persan;Le maine coon;Confirmé;C'est en 1966 au Canada qu'une chatte de gouttière donna naissance à une portée de chatons nus.;http://fr.wikipedia.org/wiki/Sphynx
20;Combien le chat a-t-il de griffes, sujettes à une pousse continue en réponse à une usure naturelle ?;18;20;16;22;Confirmé;Le chat peut ajuster la longueur de ses griffes et les aiguiser en les frottant contre une surface rugueuse : il « fait ses griffes ».;http://fr.wikipedia.org/wiki/Chat
21;Quel pourcentage les chats de race représentent-ils parmi la population totale ?;5 %;15 %;25 %;35 %;Expert;Si votre animal est un chat de race, il doit posséder un pedigree ou avoir fait l'objet d'une demande spécifique.;http://fr.wikipedia.org/wiki/Chat
22;Bastet, déesse de la joie du foyer aux traits félins est une déesse de quelle nationalité ?;Égyptienne;Grecque;Romaine;Viking;Expert;Bastet est l'une des déesses les plus discrètes du panthéon égyptien et n'est jamais représentée.;http://fr.wikipedia.org/wiki/Bastet
23;Le Manx est un chat très particulier car il ne possède pas...;De queue;De poils;De nez;De moustaches;Expert;La mutation du gène s'est développée sur l'île de Man à cause de l'isolement des chats et de la trop forte consanguinité.;http://fr.wikipedia.org/wiki/Manx_(chat)
24;Où sont situées les glandes odoriférantes chez le chat ?;Dans le ventre;Sous les pattes;Derrière les oreilles;Sur la langue;Expert;Les chats communiquent principalement entre eux par des phéromones ou des positions corporelles.;http://fr.wikipedia.org/wiki/Chat
25;Selon Le langage courant, comment appelle-t-on un chat en argot ?;Un greffier;Un grognant;Un bourrin;Un canasson;Expert;Deux explications s'opposent : le jeu de mot sur « griffe » ainsi que la fourrure de certains chats évoquant la robe des greffiers.;http://fr.wikipedia.org/wiki/Chat
26;À quel gène responsable de l'absence de pigment dans le poil est lié la surdité des chats blancs ?;Gène W;Gène X;Gène Y;Gène Z;Expert;Il est en effet démontré que l'allèle W est directement responsable d'une dégénérescence de l'oreille interne, occasionnant la surdité.;http://fr.wikipedia.org/wiki/Chat
27;À combien de degrés se monte le champ de vision total du chat, plus étendu que celui des humains ?;287 degrés;253 degrés;206 degrés;175 degrés;Expert;L'angle de vision binoculaire est de 130°, pour un champ de vision total de 287°, contre seulement 180° chez l'homme.;http://fr.wikipedia.org/wiki/Chat
28;Comment appelle-t-on un chat domestique qui retourne à l'état sauvage ?;Haret;Ragdoll;Sibérien;Chartreux;Expert;Le chat haret, ou chat errant, peut avoir connu la vie auprès des êtres humains ou bien être né dans la nature.;http://fr.wikipedia.org/wiki/Chat_haret
29;Quel ecclésiastique et homme d'État possédait 14 chats à sa mort ?;Richelieu;Colbert;Napoléon;Louis XV;Expert;Pour l'anecdote, le Cardinal de Richelieu a contribué à faire considérer les chats comme animaux de compagnie.;http://fr.wikipedia.org/wiki/Armand_Jean_du_Plessis_de_Richelieu
30;Comment s'appelle le chat du Chat qui parlait malgré lui de Claude Roy ?;Gaspard;Thomas;Titus;Chaminou;Expert;Claude Roy, né et mort à Paris, était un poète, journaliste et écrivain français.;http://fr.wikipedia.org/wiki/Claude_Roy_(écrivain)1;Quel film à succès a réuni sur les écrans Sean Connery et Christophe Lambert ?;Highlander;Subway;Mad Max;Greystoke;Débutant;A Kind of Magic est un album du groupe Queen, sorti en juin 1986, dont six de ses neuf morceaux sont utilisés dans le film Highlander.;http://fr.wikipedia.org/wiki/Highlander
2;Quel pays, dont les premiers habitants étaient des Newars, a pour capitale Katmandou ?;Le Népal;Le Tibet;La Corée du Nord;Le Pakistan;Débutant;Katmandou est la capitale politique et religieuse du Népal ainsi que la plus grande ville du pays.;http://fr.wikipedia.org/wiki/Katmandou
3;Dans quel film John Travolta incarne-t-il un ange tombé du ciel ?;Michael;Johnny;Sam;Jerry;Débutant;Deux journalistes enquêtent sur un soi-disant vrai ange vivant chez une dame âgée.;http://fr.wikipedia.org/wiki/Michael_(film,_1996)
4;Pour quel auteur-compositeur-interprète français aux 40 millions de disques vendus Capri est-il fini ?;Hervé Vilard;Salvatore Adamo;Serge Lama;Charles Aznavour;Débutant;Didier Barbelivien, Michel Fugain et Danyel Gérard ont composé pour Hervé Vilard.;http://fr.wikipedia.org/wiki/Hervé_Vilard
5;Quel peintre, né en 1844, est également appelé « le Douanier » ?;Henri Rousseau;Pablo Picasso;Edgar Degas;Salvador Dali;Débutant;Le premier portrait réalisé par le peintre Henri Rousseau semble être celui de sa première femme.;http://fr.wikipedia.org/wiki/Henri_Rousseau
6;Quel personnage imaginaire fut popularisé par le roman de E.R. Burroughs et par le cinéma ?;Tarzan;King-Kong;Nessie;Le Yéti;Débutant;Edgar Rice Burroughs a inspiré bon nombre d'auteurs de science-fiction et de fantastique.;http://fr.wikipedia.org/wiki/Edgar_Rice_Burroughs
7;Quelle est la seule valeur à la roulette à porter la couleur verte ?;Le zéro;Le quarante;Le cinquante;Le treize;Débutant;À la roulette, chaque joueur mise sur un numéro qu'il espère être tiré.;http://fr.wikipedia.org/wiki/Roulette_(jeu_de_hasard)
8;Quelle est la race du chien de Columbo, l'inspecteur très obstiné et perspicace ?;Basset;Beagle;Bichon;Barbet;Débutant;Interrompue en 1978, la série Columbo a été ressuscitée en 1989, toujours avec Peter Falk.;http://fr.wikipedia.org/wiki/Columbo
9;Quelle est la plus petite unité de mémoire utilisable sur un ordinateur ?;Le bit;Le byte;Le giga;Le méga;Débutant;La mémoire est un composant matériel essentiel, présent dans tous les ordinateurs et consoles.;http://fr.wikipedia.org/wiki/Mémoire_(informatique)
10;Dans le langage familier, comment appelle-t-on la dent du petit enfant ?;La quenotte;La menotte;La bouillotte;La marmotte;Débutant;Il est particulièrement important de bien se brosser les dents de manière régulière.;http://fr.wikipedia.org/wiki/Dent
11;Où se situe la célèbre base navale américaine de Guantanamo ?;À Cuba;Au Mexique;À Hawaii;Au Paraguay;Confirmé;La base de Guantanamo détient des personnes qualifiées de « combattants hors-la-loi ».;http://fr.wikipedia.org/wiki/Prison_de_Guantánamo
12;Quelle est la spécialité du sportif tunisien Oussama Mellouli ?;La natation;Le marathon;Le football;La boxe;Confirmé;Oussama Mellouli est le premier champion olympique tunisien en natation.;http://fr.wikipedia.org/wiki/Oussama_Mellouli
13;Quel acteur français a le premier rôle dans le film Le Guépard ?;Alain Delon;Claude Brasseur;Jean Gabin;Jean-Paul Belmondo;Confirmé;Le film Le Guépard décrit la chute de l'aristocratie italienne, dont la scène du bal donne la clé.;http://fr.wikipedia.org/wiki/Le_Guépard_(film)
14;Qui était le compagnon de Paul de Tarse, désigné aussi sous le nom de saint Paul ?;Saint Luc;Saint Matthieu;Saint Jean;Saint Marc;Confirmé;Saint Paul a marqué le christianisme par son interprétation de l'enseignement de Jésus.;http://fr.wikipedia.org/wiki/Paul_de_Tarse
15;Quel titre de noblesse est immédiatement inférieur à celui de comte ?;Vicomte;Marquis;Duc;Archiduc;Confirmé;« Vicomte » est une distinction héréditaire à laquelle ne sont attachés aucuns pouvoirs.;http://fr.wikipedia.org/wiki/Vicomte
16;Quelle est la capitale de la Nouvelle-Zélande, pays d'Océanie au sud-ouest de l'océan Pacifique ?;Wellington;Dublin;Sydney;Auckland;Confirmé;Troisième ville la plus peuplée du pays, Wellington fait partie des douze meilleures villes dans laquelle vivre.;http://fr.wikipedia.org/wiki/Nouvelle-Zélande
17;Quel film a réuni sur les écrans Isabelle Adjani et Sharon Stone ?;Diabolique;Les sorcières;Ange et Démon;Les ensorceleuses;Confirmé;La femme et la maîtresse d'un professeur s'associent pour planifier son assassinat.;http://fr.wikipedia.org/wiki/Diabolique_(film)
18;Comment est également appelée la Transat Jacques Vabre ?;La Route du café;La Route du rhum;Le Trophée du rhum;Le Vendée Globe;Confirmé;La Transat Jacques Vabre, course transatlantique en double, se déroule tous les deux ans depuis 1993.;http://fr.wikipedia.org/wiki/Transat_Jacques_Vabre
19;Quel oiseau vivant dans l’hémisphère nord nage le plus vite ?;Le pingouin;La bécassine;Le martinet;La pie;Confirmé;Par abus de langage, le pingouin est souvent confondu avec le manchot.;http://fr.wikipedia.org/wiki/Pingouin
20;Quelle est la plus grosse des planètes du Système solaire ?;Jupiter;Saturne;Uranus;Neptune;Confirmé;Jupiter est une planète géante gazeuse, la plus grosse planète du système solaire.;http://fr.wikipedia.org/wiki/Jupiter_(planète)
21;Apparu il y a 450 millions d'années, à quelle classe animale le scorpion appartient-il ?;Aux arachnides;Aux reptiles;Aux insectes;Aux mammifères;Expert;Les scorpions se distinguent des araignées par un aiguillon venimeux situé au bout de leur abdomen.;http://fr.wikipedia.org/wiki/Scorpiones
22;Quel frère d'une actrice prénommée Mary a réalisé le film La fièvre du samedi soir ?;John Badham;John Travolta;John Payne;John Remezick;Expert;La fièvre du samedi soir fut un des principaux vecteurs de diffusion de la musique et de la mode disco.;http://fr.wikipedia.org/wiki/La_Fièvre_du_samedi_soir
23;Au Moyen Âge, comment appelait-on un village fortifié ?;Une bastide;Un château fort;Un rempart;Une tour;Expert;Les bastides les plus connues sont celles de Monflanquin, Monpazier, Grenade ou bien encore Libourne.;http://fr.wikipedia.org/wiki/Bastide_(ville)
24;Quelle ville du Kent est célèbre pour sa source miraculeuse ?;Tunbridge Wells;Gillingham;Dartford;Ramsgate;Expert;De nombreuses personnes célèbres sont venues en cure à Tunbridge Wells, comme la reine Victoria.;http://fr.wikipedia.org/wiki/Tunbridge_Wells
